{
  "schemaVersion": "1",
  "reportKind": "sarif-regress-independent-holdout",
  "evaluation": {
    "repositoryCommitSha": "df45e021bc4d2b3c2fd0155bf75ae3967ee80b0d",
    "sourceTreeSha256": "317f294b9f52ea9ec78388f9bb96e219d3de4db2607d48c9e9fae1e8be21f7cf",
    "sarifRegressToolVersion": "0.1.0",
    "matcherAlgorithmVersion": "sarifregress/matcher/v2",
    "fingerprintAlgorithmVersions": [
      {
        "name": "derived-fingerprint",
        "version": "rule-path-context/v2"
      },
      {
        "name": "derived-fingerprint-compare",
        "version": "sarifregress/derived-fingerprint-compare/v1"
      },
      {
        "name": "embedded-snippet",
        "version": "embedded-snippet/v1"
      },
      {
        "name": "producer-fingerprint-common",
        "version": "sarifregress/producer-fingerprint-common-version/v1"
      }
    ],
    "outputSchemaVersion": "1",
    "configurationSchemaVersion": "1",
    "holdoutManifestSha256": "b9cf6325e2758889449aa021b5b45b3636e17a0dcf65d3c7dba215c2964fe379"
  },
  "aggregate": {
    "groundTruthUnits": 99,
    "labelledRelationships": 75,
    "labelledMatches": 0,
    "truePositives": 0,
    "falsePositives": 0,
    "falseNegatives": 75,
    "classificationMismatches": 0,
    "newClassifications": 30,
    "resolvedClassifications": 30,
    "ambiguousClassifications": 60,
    "correctNewClassifications": 3,
    "correctResolvedClassifications": 3,
    "correctAmbiguityRefusals": 2,
    "unexpectedAmbiguityRefusals": 25,
    "incorrectlyAutoMatchedAmbiguousCases": 0,
    "ingestionFailures": 2,
    "structuralFailures": 0,
    "precision": 1,
    "recall": 0,
    "f1": 0
  },
  "producers": [
    {
      "producerId": "gitleaks",
      "metrics": {
        "groundTruthUnits": 33,
        "labelledRelationships": 25,
        "labelledMatches": 0,
        "truePositives": 0,
        "falsePositives": 0,
        "falseNegatives": 25,
        "classificationMismatches": 0,
        "newClassifications": 0,
        "resolvedClassifications": 0,
        "ambiguousClassifications": 60,
        "correctNewClassifications": 0,
        "correctResolvedClassifications": 0,
        "correctAmbiguityRefusals": 2,
        "unexpectedAmbiguityRefusals": 25,
        "incorrectlyAutoMatchedAmbiguousCases": 0,
        "ingestionFailures": 0,
        "structuralFailures": 0,
        "precision": 1,
        "recall": 0,
        "f1": 0
      }
    },
    {
      "producerId": "pmd",
      "metrics": {
        "groundTruthUnits": 33,
        "labelledRelationships": 25,
        "labelledMatches": 0,
        "truePositives": 0,
        "falsePositives": 0,
        "falseNegatives": 25,
        "classificationMismatches": 0,
        "newClassifications": 30,
        "resolvedClassifications": 30,
        "ambiguousClassifications": 0,
        "correctNewClassifications": 3,
        "correctResolvedClassifications": 3,
        "correctAmbiguityRefusals": 0,
        "unexpectedAmbiguityRefusals": 0,
        "incorrectlyAutoMatchedAmbiguousCases": 0,
        "ingestionFailures": 0,
        "structuralFailures": 0,
        "precision": 1,
        "recall": 0,
        "f1": 0
      }
    },
    {
      "producerId": "semgrep",
      "metrics": {
        "groundTruthUnits": 33,
        "labelledRelationships": 25,
        "labelledMatches": 0,
        "truePositives": 0,
        "falsePositives": 0,
        "falseNegatives": 25,
        "classificationMismatches": 0,
        "newClassifications": 0,
        "resolvedClassifications": 0,
        "ambiguousClassifications": 0,
        "correctNewClassifications": 0,
        "correctResolvedClassifications": 0,
        "correctAmbiguityRefusals": 0,
        "unexpectedAmbiguityRefusals": 0,
        "incorrectlyAutoMatchedAmbiguousCases": 0,
        "ingestionFailures": 2,
        "structuralFailures": 0,
        "precision": 1,
        "recall": 0,
        "f1": 0
      }
    }
  ],
  "cases": [
    {
      "caseId": "gitleaks",
      "producerId": "gitleaks",
      "status": "evaluated",
      "inputHashes": {
        "baselineSarifSha256": "1a09b8b78e50c157ce16cdd3e21edffdeaec2deb88337c185d44f0fa5ff81a5c",
        "candidateSarifSha256": "57e66495752f67407be384eab0a6b2197abfde72df88921edbf8cc292e6f82f5",
        "labelsSha256": "1f17cc8e0eab4e94c70519817c42430a3344c42bd55c2ecd044d1d5f4b84b026",
        "notesSha256": "9bba156586dda36a00197623a04c80aba48d2de45165f0ad954f2c903bb5fb6d",
        "producerInputTreeSha256": "059fcfe68af567e7c97a746e4174afff67932532368973e40a3dc3d8f612fbf3",
        "configSha256": "68b03ba1cfa51168e345f90c25dc7390fcb706a4e7c83de7ae2334c0a5dea190"
      },
      "engineReportSha256": "85c0dea7570372ee0a03e0b14f55c473cd4000fd0ead2261932b432c8a9365b1",
      "metrics": {
        "groundTruthUnits": 33,
        "labelledRelationships": 25,
        "labelledMatches": 0,
        "truePositives": 0,
        "falsePositives": 0,
        "falseNegatives": 25,
        "classificationMismatches": 0,
        "newClassifications": 0,
        "resolvedClassifications": 0,
        "ambiguousClassifications": 60,
        "correctNewClassifications": 0,
        "correctResolvedClassifications": 0,
        "correctAmbiguityRefusals": 2,
        "unexpectedAmbiguityRefusals": 25,
        "incorrectlyAutoMatchedAmbiguousCases": 0,
        "ingestionFailures": 0,
        "structuralFailures": 0,
        "precision": 1,
        "recall": 0,
        "f1": 0
      },
      "relationshipResults": [
        {
          "relationshipId": "gitleaks-ambiguous-001",
          "groundTruth": {
            "kind": "ambiguous",
            "baselineKey": "baseline:0:0",
            "candidateKey": "candidate:0:0",
            "expectedClassification": "ambiguous"
          },
          "actual": {
            "state": "ambiguous",
            "baselineKey": "baseline:0:0",
            "candidateKey": "candidate:0:0"
          },
          "outcome": "correct-ambiguity-refusal"
        },
        {
          "relationshipId": "gitleaks-ambiguous-002",
          "groundTruth": {
            "kind": "ambiguous",
            "baselineKey": "baseline:0:1",
            "candidateKey": "candidate:0:1",
            "expectedClassification": "ambiguous"
          },
          "actual": {
            "state": "ambiguous",
            "baselineKey": "baseline:0:1",
            "candidateKey": "candidate:0:1"
          },
          "outcome": "correct-ambiguity-refusal"
        },
        {
          "relationshipId": "gitleaks-match-001",
          "groundTruth": {
            "kind": "match",
            "baselineKey": "baseline:0:10",
            "candidateKey": "candidate:0:10",
            "expectedClassification": "moved"
          },
          "actual": {
            "state": "ambiguous",
            "baselineKey": null,
            "candidateKey": "candidate:0:10"
          },
          "outcome": "unexpected-ambiguity-refusal"
        },
        {
          "relationshipId": "gitleaks-match-002",
          "groundTruth": {
            "kind": "match",
            "baselineKey": "baseline:0:11",
            "candidateKey": "candidate:0:11",
            "expectedClassification": "moved"
          },
          "actual": {
            "state": "ambiguous",
            "baselineKey": null,
            "candidateKey": "candidate:0:11"
          },
          "outcome": "unexpected-ambiguity-refusal"
        },
        {
          "relationshipId": "gitleaks-match-003",
          "groundTruth": {
            "kind": "match",
            "baselineKey": "baseline:0:12",
            "candidateKey": "candidate:0:12",
            "expectedClassification": "modified"
          },
          "actual": {
            "state": "ambiguous",
            "baselineKey": null,
            "candidateKey": "candidate:0:12"
          },
          "outcome": "unexpected-ambiguity-refusal"
        },
        {
          "relationshipId": "gitleaks-match-004",
          "groundTruth": {
            "kind": "match",
            "baselineKey": "baseline:0:13",
            "candidateKey": "candidate:0:13",
            "expectedClassification": "modified"
          },
          "actual": {
            "state": "ambiguous",
            "baselineKey": null,
            "candidateKey": "candidate:0:13"
          },
          "outcome": "unexpected-ambiguity-refusal"
        },
        {
          "relationshipId": "gitleaks-match-005",
          "groundTruth": {
            "kind": "match",
            "baselineKey": "baseline:0:14",
            "candidateKey": "candidate:0:14",
            "expectedClassification": "modified"
          },
          "actual": {
            "state": "ambiguous",
            "baselineKey": null,
            "candidateKey": "candidate:0:14"
          },
          "outcome": "unexpected-ambiguity-refusal"
        },
        {
          "relationshipId": "gitleaks-match-006",
          "groundTruth": {
            "kind": "match",
            "baselineKey": "baseline:0:15",
            "candidateKey": "candidate:0:15",
            "expectedClassification": "modified"
          },
          "actual": {
            "state": "ambiguous",
            "baselineKey": null,
            "candidateKey": "candidate:0:15"
          },
          "outcome": "unexpected-ambiguity-refusal"
        },
        {
          "relationshipId": "gitleaks-match-007",
          "groundTruth": {
            "kind": "match",
            "baselineKey": "baseline:0:16",
            "candidateKey": "candidate:0:16",
            "expectedClassification": "modified"
          },
          "actual": {
            "state": "ambiguous",
            "baselineKey": null,
            "candidateKey": "candidate:0:16"
          },
          "outcome": "unexpected-ambiguity-refusal"
        },
        {
          "relationshipId": "gitleaks-match-008",
          "groundTruth": {
            "kind": "match",
            "baselineKey": "baseline:0:17",